Caves And Sabertooths ,A beautifully illustrated book depicts on the cover a man with a spear turning to face a sabertooth tiger leaping down on him with a wide mouth. ,the tabletop Roleplay Game from a brutal world without technology or magic. 
The Flawless Fiefdom,,How do keep your peasants prosperous and profitable
Are You My Mother?,A colorfully illustrated children's book showing a small child with pointed ears looking up at a stone golumn. ,"The book follows a child who approaches various individuals and asks ""Are you my mother?"" - At the end it's revealed that the child is actually a dragon who shapeshifted into a humanoid form by accident, and the mother really was the huge dragon from the beginning that the child passed over, since they looked nothing alike. "
We All Drift Together ,,"What begins as a serious intillectual reflection on the philisophical implications of gods and mortals influencing each other so directly begins to trail off around chapter 3 into a lengthy complaint about current drug laws and how hallucinagens ought not to be restricted. The final two chapters are comprised entirely of hand-drawn doodles of snails, leaves, and sabertoothed tigers. "
A Treatise On Goblins In Society (By The Gabbo Initiative) ,This red book is dirty and missing some pages. The edges appear to have been gnawed on. ,"The now defunct Gabbo Initiative was a collection of Wizards convinced Goblins could be productive members of society. It ended just as well as you'd expect.
The Art Of Ghosting ,A plain grey book with dark grey lettering. ,"A memoir written by a spirit revived by necromancy, about how to effectively drop contact with an ex-girlfriend and pretend you vanished off the face of the earth. The final chapter earnestly reminds the reader to not actually die for real. "
50 Animals You Can Stuff Into A Burrito ,"It appears to be a cookbook, with a fluffy grey, blue-eyed kitten on the front cover. ","This is not a recipe book. It's a heavily-illustrated journal of one woman's quest to wrap various animals tightly into a towel or large blanket, to make a 'burrito' with them. There are 50 successes, and several failed attempts wheren she had to flee from various monsters to avoid injury or death.  The final success is a little grey kitten wrapped in a towel, tail and head poking out each end. Instead of a descriptive entry explaining how she found and approached the animal, it is simply titled ""Purrito :) "" "
A Witch's Guide To Handling Disaster ,A neatly-bound purple tome with a crystal and crow's feather quill illustrated on the front. ,"It is a sensible guide to filing various forms of paperwork, from a witch who works in the administration office of a major city. it describes how to evaluate spellwork damage or fatal fights breaking out, how to assign teams to clean it up, and important details to include in the filing. "
Bark Choy: Thriving Together,"A cheerful, fluffy white dog holding a grocery basket is illustrated on the front cover. ","An instruction manual on how to train your dog to go grocery shopping, retreiving the mail, and other small tasks around town. Written by an ex-ranger whose adventuring injury and severe social phobia is now aided by a service dog. "
Dieties For Dummies ,A colorful and simple primer ,"Overviews the major gods in the campaign setting, and includes a handy illustrated reference guide on which common holy symbols belong to which god. "
Doppelganger Diaries: Together We Ride ,The cover depicts several overlapping handprints of different sizes and finger configurations ,The first book in a steamy series about one young doppelganger in the world's most complicated polycule. 
"Light and Darkness, Truth and Other Falsehoods",,
Of Mimics and Men,A cowhide-bound book with wiry black fur. A thin length of chain connects it to the shelf it's sitting on.  (Investigation 12 or greater: you notice several tiny black eyes blink open and shut when it things you're not looking) ,"It's a really sad book that english teachers like to assign- Ah, wait, no. It's a mimic. Good thing it's a small one, right?!  (Note: Higher-level DMs may decide to turn the entire bookshelf and bump up the stats)"
A Manual of Brevity,A very thin book composed mostly of thick red hardcovers and not many pages,"There's only 1 page. It reads: ""Get to the point."" "
Identifying Wood ,"Subtitle: Yep, that's wood.  Illustration is a man peering intently at a chunk of firewood ","Inside is a manual explaining exactly WHAT wood is, and how to identify different parts of it when it's crafted into other things. "
Lumber selection for building brawl resistant taverns.,,A shopper's guide to choosing sturdy and fire-resistant lumber that can resist even the most enthusiastic small riot. 
Hydraulaturgy: Reflections on theoretical magical influence on the hydrosphere.,,"101 uses for the cantrip ""Create or Destroy Water"" -  most of this volume is actually taken up by a concerned thesis explaining that one did neither create nor destroy water with this spell, but rather it is a form of summoning, pulling ambient atmosphere from the elemental plane of water."
"Bubble, boil, toil and trouble: How to fix recipes that have gone wrong.",,"Most of the advice boils down to ""Add more potatoes"", ""Add more garlic"" or ""Dump it out and try again. but measure into seperate containers this time."""
Liking lichen: A herbalists guide to growing lichen.,,"The particular lichen most described in this book (though others are mentioned) appears to have a very mild bioluminescent quality. Not enough for torchlight, but perhaps if grown on a ceiling it could replicate a starry sky?"
Dirt Is Dirt: The phrase that started the Dwarven riot of 1107,,"A historical log of the Dwarven Undercity Riots of 1107, what allegedly sparked it, and other phrases known to set off certain politcal factions of dwarves."
Twine techniques for bundling books,,"A free and open-source tool created by sorcerer Chris Klimas for making interactive fiction.  Using arcane symbols, one can link up many books and sync them to a specific story with multiple endings that the reader can choose themselves! It claims to be written in ""Lavascript"""
Adventures in Deep Sea Knitting ,,"A charming adventure book following a young gnome as he swm through the deep, knitting scarves and sweaters for the chilly fish in the cold depths. "
"Light and Darkness, Truth and Other Falsehoods","the book looks like a very, very damaged leather notebook with Elder Seal in lower outside corner of every page.",insane ramblings on Far Realm
Medical Mistrust: Choosing the Pox instead of a vaccine,,"A medic's resigned and frustrated analysis of cult-like behavior, paranoia, distrust of authority figures and misunderstandings of how medicine worked would lead to a widespread plague breakout. "
Proper Cures For Gentle Maladies ,,"Using terminology you've only heard your grandmother speak, the author describes various odd maladies and equally odd cures. An Ague is described as ""an intermitting fever, proceeded by cold shivering and ending in sweat"" is meant to be cured with 'A gentle vomit' and six pills of cobwebs.  Tar water, sea water, nettlejuice and quicksilver are all acceptable cures for ""Moist Asthma"""
Trepanation: When the headache just won't quit,,A guide to self-administering forms for Trepanation (a drill-hole through the skull )
Mazes & Monsters ,," Rulebook for a table-top roleplaying game set in ancient times, complete with a set of dice."
Why I Did It,,"A collection of letters written by various people, detailling their motivations for doing utterly insignificant things. Surprisingly sentimental at times. "
The Joy of Arsony ,"A badly burnt book, only the hardcover of which survived the flames","On the inside cover is a doodle of a young girl looking at the reader, with what appears to be a housefire behind her. "
If I Was a Rich Man,," A 6-page booklet starting with ""If I was a rich man, I would buy"" followed by a list of things the author would buy if they were, in fact, a rich man."
A Traveler's Guide to Mushrooms,,"A large collection of illustrations of various plants and animals, identifying whether or not they are mushrooms by means of writing ""MUSHROOM :D"" or ""NOT MUSHROOM :("" under it."
I Swear I'm Not A Mimic,," A big, dusty book that clearly hasn't been touched in ages and contains the diary of a troubled teenager."
101 Jokes to Liven Up Any Funeral,,"A collection of utterly tasteless jokes, puns, and word riddles. The prelude claims it was written by a man on his deathbed, hoping his friends would ""remember me with a groan and an affectionate scoff."""